{"entries":{"bytes":2621,"count":1,"path":"catalog/entries.jsonl","sha256":"357f4dc002b6a81bb16c34a0206bb015564052edf4733a0bff94b151e391cfe0"},"generatedAt":"2026-08-28T08:55:42Z","previewManifest":{"bytes":261,"path":"catalog/preview-manifest.json","sha256":"ee07e00b132e1f666c8105854bb0f6a28bfbac8de010e09bf6bc8a223e37ea6d"},"previews":{"bytes":500,"count":1,"path":"catalog/previews.jsonl","sha256":"1a903cd7b1ba71523041f7bc3b8ccfb6fbd5aa0ef921e05f86884e667c318eb4"},"provider":{"archiveRepository":"jarxunlai/ScientificFigureLibrary-community-archives","catalogRepository":"jarxunlai/ScientificFigureLibrary-community","displayName":"Scientific Figure Library Community","providerId":"io.github.jarxunlai.scientific-figure-community"},"retiredReleases":{"bytes":575,"count":3,"path":"catalog/retired-releases.jsonl","sha256":"c2abc68ea69eb46fe2e5f9c3a399de799c93492324bc980fc698402c60772b17"},"schema":"figure-library.public-provider-catalog.v2"}
